produto,marca,categoria,categoria_original,descricao,id,preco,url_produto,volume
Golden Care Creme Anti-Aging Corporal - 240g,Adcos,Cuidados Especiais,Cuidados Especiais,"O Creme Anti-Aging Corporal Golden Care é um hidratante que promove nutrição intensiva para pele secas e maduras. Sua fórmula possui princípios ativos que previnem e minimizam a perda de elasticidade, tônus e hidratação, garantindo uma pele uniforme, hidratada e revitalizada. É indicado para mulheres pós-menopausa.",bdc73aec-d4d0-49ad-b917-4d2dc995326c,"R$ 289,00",https://www.lojaadcos.com.br/creme-revitalizante-corporal-golden-care-240-g/p?skuId=2000062,240g
Desodorante Spray - Antitranspirante - 120ml,Adcos,Desodorante,Desodorante,"O Desodorante Spray é antitranspirante e antisséptico, sem álcool em sua composição e sem perfume. Diminui a transpiração excessiva e a proliferação bacteriana responsável pelo odor desagradável. Possui ação bactericida.",f51e6e48-d370-4a69-b0d1-89580c52eef3,"R$ 139,00",https://www.lojaadcos.com.br/desodorante-spray-140-ml/p?skuId=2000038,120ml
Elastcream - Creme para Estrias - 200g,Adcos,Cuidados Especiais,Cuidados Especiais,"O Elastcream é um creme para estrias que hidrata, nutre e promove aumento da elasticidade da pele, prevenindo o surgimento de estrias. Tem rápida absorção, não deixa resíduos de oleosidade e fortalece as fibras, servindo para prevenção e tratamento para estrias.",04b16465-1331-42b0-a263-40ae637e3695,"R$ 269,00",https://www.lojaadcos.com.br/creme-para-o-corpo-elastcream-240-g/p?skuId=2000035,200g
Hair Solution Condicionador Nutri Ativo - Restauração - 300ml,Adcos,Restauração,Restauração,"O Hair Solution Condicionador Nutri Ativo foi criado para tratar cabelos desvitalizados, quebradiços, danificados por agentes naturais e químicos. Ele garante hidratação e nutrição intensiva dos fios, recuperando cabelos ressecados e/ou danificados.",9468cfb6-b44b-4072-8f34-0ab591a7f4e5,"R$ 189,00",https://www.lojaadcos.com.br/hair-solution-condicionador-nutri-ativo-300-ml/p?skuId=2000048,300ml
Hair Solution Shampoo Nutri Ativo - Restauração - 300ml,Adcos,Restauração,Restauração,"O Hair Solution Shampoo Nutri Ativo foi criado para nutrição intensiva e reestruturação capilar, com ação antiquebra e pró-elasticidade dos fios. Esse shampoo nutritivo promove força aos cabelos, devolve o brilho, maciez e hidrata os fios, protegendo das agressões externas. Ele repõe a hidratação através de 8 aminoácidos hidratantes e atua limpando profundamente sem ressecar, melhora a flexibilidade e a resistência dos fios, além de não conter sal, álcool e ser dermatologicamente testado.",443fd53f-2782-4a6f-aa3d-5c7342a39e67,"R$ 179,00",https://www.lojaadcos.com.br/hair-solution-shampoo-nutri-ativo-300-ml/p?skuId=2000047,300ml
Hair Solution Shampoo Fito Ativo - Fortificante - 300ml,Adcos,Antiqueda,Antiqueda,"O Hair Solution Shampoo Fito Ativo possui ação antiqueda, fortalece e dá brilho, com nutrientes essenciais para os cabelos crescerem fortes e saudáveis. Esse shampoo antiqueda estimula o crescimento dos fios, possui ação antiquebra e pró-elasticidade, que dá força e resistência aos cabelos.  Limpa profundamente sem ressecar, previne a queda dos cabelos através da ação estimulante e revitalizante do bulbo capilar.",ded93ad3-057f-42dd-8f26-5a364de9c54a,"R$ 199,00",https://www.lojaadcos.com.br/hair-solution-shampoo-fito-ativo-hair-solution-300-ml/p?skuId=2000046,300ml
Hair Solution Loção Fortificante Fito Ativa - Auxiliar Antiqueda - 120ml,Adcos,Antiqueda,Antiqueda,"O Hair Solution Loção Fito Ativa é um concentrado em spray com nutrientes essenciais para o cabelo crescer forte e saudável. Ele possui ação antioxidante, ajuda no crescimento dos fios, auxilia na prevenção da queda e fortalece os cabelos. Sua textura é leve e de rápida absorção, que não deixa resíduos, além disso, o produto possui ceramidas, que mantêm os fios macios e brilhantes.",f2c97751-59c0-4d11-a5c5-8a6752054622,"R$ 169,00",https://www.lojaadcos.com.br/hair-solution-locao-fito-ativa-antiqueda-120-ml/p?skuId=2000045,120ml
Hair Solution Shampoo Bio Ativo - Anticaspa - 300ml,Adcos,Anticaspa,Anticaspa,"O Hair Solution Shampoo Bio Ativo combate a caspa e limpa profundamente a região, com ação antisséptica, purificante e normalizadora da função sebácea. Ele reduz a coceira e a descamação do couro cabeludo, limpa profundamente sem ressecar e não agride o cabelo e nem o couro cabeludo. Ele favorece a eliminação da caspa visivelmente e restaura o equilíbrio fisiológico do couro cabeludo.",519e1d5a-bc37-484c-887a-f1371020246a,"R$ 179,00",https://www.lojaadcos.com.br/hair-solution-shampoo-bio-ativo-300-ml/p?skuId=2000044,300ml
